https://doi.org/10.1145/3594633,Quotation Recommendation for Multi-party Online Conversations Based on Semantic and Topic Fusion,"Lingzhi Wang, Xingshan Zeng,  + 1",94,ACM Transactions on Information Systems (TOIS),ACM Transactions on Information Systems,91.76,ACM,Explainable Recommender
https://doi.org/10.1145/3365843,Generating and Understanding Personalized Explanations in Hybrid Recommender Systems,"Pigi Kouki, James Schaffer,  + 3",31,ACM Transactions on Interactive Intelligent Systems (TIIS),ACM Transactions on Information Systems,72.16,ACM,Explainable Recommender
https://doi.org/10.1145/3477495.3531973,Explainable Fairness in Recommendation,"Yingqiang Ge, Juntao Tan, Yan Zhu,  + 7",2022,SIGIR '22: Proceedings of the 45th International ACM SIGIR Conference on Research and Development in Information Retrieval,International ACM SIGIR Conference on Research and Development in Information Retrieval (SIGIR),80.18,ACM,Explainable Recommender
https://doi.org/10.1145/3565798,Dual Preference Distribution Learning for Item Recommendation,"Xue Dong, Xuemeng Song, Na Zheng,  + 2",56,ACM Transactions on Information Systems (TOIS),ACM Transactions on Information Systems,91.76,ACM,Explainable Recommender
https://doi.org/10.1145/3404835.3463248,EXTRA: Explanation Ranking Datasets for Explainable Recommendation,"Lei Li, Yongfeng Zhang, Li Chen",2021,SIGIR '21: Proceedings of the 44th International ACM SIGIR Conference on Research and Development in Information Retrieval,International ACM SIGIR Conference on Research and Development in Information Retrieval (SIGIR),80.18,ACM,Explainable Recommender
https://doi.org/10.1145/3624918.3625331,"AdaReX: Cross-Domain, Adaptive, and Explainable Recommender System","Yi Yu, Kazunari Sugiyama, Adam Jatowt",2023,SIGIR-AP '23: Proceedings of the Annual International ACM SIGIR Conference on Research and Development in Information Retrieval in the Asia Pacific Region,International ACM SIGIR Conference on Research and Development in Information Retrieval (SIGIR),71.49,ACM,Explainable Recommender
https://doi.org/10.1145/3369396,Algorithmic and HCI Aspects for Explaining Recommendations of Artistic Images,"Vicente Dominguez,  + 3",30,ACM Transactions on Interactive Intelligent Systems (TIIS),ACM Transactions on Information Systems,72.16,ACM,Explainable Recommender
https://doi.org/10.1145/3539618.3592070,The Dark Side of Explanations: Poisoning Recommender Systems with Counterfactual Examples,"Ziheng Chen, Fabrizio Silvestri,  + 3",2023,SIGIR '23: Proceedings of the 46th International ACM SIGIR Conference on Research and Development in Information Retrieval,International ACM SIGIR Conference on Research and Development in Information Retrieval (SIGIR),80.18,ACM,Explainable Recommender
https://doi.org/10.1145/3487351.3489472,Compressing and mining social network data,"Connor C. J. Hryhoruk, Carson K. Leung",2021,ASONAM '21: Proceedings of the 2021 IEEE/ACM International Conference on Advances in Social Networks Analysis and Mining,IEEE/ACM International Conference on. Advances in Social Networks Analysis and Mining (ASONAM),78.50,ACM,Explainable Recommender
https://doi.org/10.1145/3331184.3331649,EARS 2019: The 2nd International Workshop on ExplainAble Recommendation and Search,"Yongfeng Zhang, Yi Zhang,  + 2",2019,SIGIR'19: Proceedings of the 42nd International ACM SIGIR Conference on Research and Development in Information Retrieval,International ACM SIGIR Conference on Research and Development in Information Retrieval (SIGIR),80.56,ACM,Explainable Recommender
https://doi.org/10.1145/3331184.3331390,SIGIR 2019 Tutorial on Explainable Recommendation and Search,"Yongfeng Zhang, Jiaxin Mao, Qingyao Ai",2019,SIGIR'19: Proceedings of the 42nd International ACM SIGIR Conference on Research and Development in Information Retrieval,International ACM SIGIR Conference on Research and Development in Information Retrieval (SIGIR),80.56,ACM,Explainable Recommender
https://doi.org/10.1145/3539618.3591876,"Towards Building Voice-based Conversational Recommender Systems: Datasets, Potential Solutions and Prospects","Xinghua Qu, Hongyang Liu, Zhu Sun,  + 4",2023,SIGIR '23: Proceedings of the 46th International ACM SIGIR Conference on Research and Development in Information Retrieval,International ACM SIGIR Conference on Research and Development in Information Retrieval (SIGIR),80.18,ACM,Explainable Recommender
https://doi.org/10.1145/3570501,Explainable Hyperbolic Temporal Point Process for User-Item Interaction Sequence Generation,"Yuchen Zhou, Yanan Cao,  + 5",83,ACM Transactions on Information Systems (TOIS),ACM Transactions on Information Systems,91.76,ACM,Explainable Recommender
https://doi.org/10.1145/3209978.3210193,SIGIR 2018 Workshop on ExplainAble Recommendation and Search (EARS 2018),"Yongfeng Zhang, Yi Zhang, Min Zhang",2018,SIGIR '18: The 41st International ACM SIGIR Conference on Research & Development in Information Retrieval,International ACM SIGIR Conference on Research and Development in Information Retrieval (SIGIR),84.00,ACM,Explainable Recommender
https://doi.org/10.1145/3404835.3463247,HOOPS: Human-in-the-Loop Graph Reasoning for Conversational Recommendation,"Zuohui Fu, Yikun Xian, Yaxin Zhu,  + 4",2021,SIGIR '21: Proceedings of the 44th International ACM SIGIR Conference on Research and Development in Information Retrieval,International ACM SIGIR Conference on Research and Development in Information Retrieval (SIGIR),80.18,ACM,Explainable Recommender
https://doi.org/10.1145/3589345,LIMEADE: From AI Explanations to Advice Taking,"Benjamin Charles Germain Lee,  + 3",24,ACM Transactions on Interactive Intelligent Systems (TIIS),ACM Transactions on Information Systems,72.16,ACM,Explainable Recommender
https://doi.org/10.1145/3437963.3441762,Temporal Meta-path Guided Explainable Recommendation,"Hongxu Chen, Yicong Li,  + 3",2021,WSDM '21: Proceedings of the 14th ACM International Conference on Web Search and Data Mining,ACM International Conference on Web Search and Data Mining (WSDM),73.89,ACM,Explainable Recommender
https://doi.org/10.1145/3605357,A Reusable Model-agnostic Framework for Faithfully Explainable Recommendation and System Scrutability,"Zhichao Xu, Hansi Zeng, Juntao Tan,  + 3",29,ACM Transactions on Information Systems (TOIS),ACM Transactions on Information Systems,91.76,ACM,Explainable Recommender
https://doi.org/10.1145/3219819.3220072,Explanation Mining: Post Hoc Interpretability of Latent Factor Models for Recommendation Systems,"Georgina Peake, Jun Wang",2018,KDD '18: Proceedings of the 24th ACM SIGKDD International Conference on Knowledge Discovery & Data Mining,International Conference on Knowledge Discovery & Data Mining (KDD),70.93,ACM,Explainable Recommender
https://doi.org/10.1109/ASONAM55673.2022.10068716,Social Network Analysis on Interpretable Compressed Sparse Networks,"Connor C. J. Hryhoruk, Carson K. Leung",2022,ASONAM '22: Proceedings of the 2022 IEEE/ACM International Conference on Advances in Social Networks Analysis and Mining,IEEE/ACM International Conference on. Advances in Social Networks Analysis and Mining (ASONAM),78.50,ACM,Explainable Recommender
https://doi.org/10.1145/3631521,Triple Dual Learning for Opinion-Based Explainable Recommendation,"Yuting Zhang, Ying Sun, Fuzhen Zhuang,  + 3",2023,ACM Transactions on Information Systems (TOIS),ACM Transactions on Information Systems,91.76,ACM,Explainable Recommender
https://doi.org/10.1145/3539618.3591884,Towards Explainable Conversational Recommender Systems,"Shuyu Guo, Shuo Zhang, Weiwei Sun,  + 3",2023,SIGIR '23: Proceedings of the 46th International ACM SIGIR Conference on Research and Development in Information Retrieval,International ACM SIGIR Conference on Research and Development in Information Retrieval (SIGIR),80.18,ACM,Explainable Recommender
https://doi.org/10.1145/3437963.3441754,Explainable Recommendation with Comparative Constraints on Product Aspects,"Trung-Hoang Le, Hady W. Lauw",2021,WSDM '21: Proceedings of the 14th ACM International Conference on Web Search and Data Mining,ACM International Conference on Web Search and Data Mining (WSDM),73.89,ACM,Explainable Recommender
https://doi.org/10.1145/3477495.3531895,Explainable Session-based Recommendation with Meta-path Guided Instances and Self-Attention Mechanism,"Jiayin Zheng, Juanyun Mai, Yanlong Wen",2022,SIGIR '22: Proceedings of the 45th International ACM SIGIR Conference on Research and Development in Information Retrieval,International ACM SIGIR Conference on Research and Development in Information Retrieval (SIGIR),80.18,ACM,Explainable Recommender
https://doi.org/10.1145/3530299,Expressive Latent Feature Modelling for Explainable Matrix Factorisation-based Recommender Systems,"Abdullah Alhejaili, Shaheen Fatima",20,ACM Transactions on Interactive Intelligent Systems (TIIS),ACM Transactions on Information Systems,72.16,ACM,Explainable Recommender
https://doi.org/10.1145/3397271.3401051,Fairness-Aware Explainable Recommendation over Knowledge Graphs,"Zuohui Fu, Yikun Xian, Ruoyuan Gao,  + 8",2020,SIGIR '20: Proceedings of the 43rd International ACM SIGIR Conference on Research and Development in Information Retrieval,International ACM SIGIR Conference on Research and Development in Information Retrieval (SIGIR),80.18,ACM,Explainable Recommender
https://doi.org/10.1145/3488560.3498515,Reinforcement Learning over Sentiment-Augmented Knowledge Graphs towards Accurate and Explainable Recommendation,"Sung-Jun Park, Dong-Kyu Chae,  + 3",2022,WSDM '22: Proceedings of the Fifteenth ACM International Conference on Web Search and Data Mining,ACM International Conference on Web Search and Data Mining (WSDM),71.60,ACM,Explainable Recommender
https://doi.org/10.1145/3477495.3531699,QUARE: 1st Workshop on Measuring the Quality of Explanations in Recommender Systems,"Alessandro Piscopo, Oana Inel, Sanne Vrijenhoek,  + 2",2022,SIGIR '22: Proceedings of the 45th International ACM SIGIR Conference on Research and Development in Information Retrieval,International ACM SIGIR Conference on Research and Development in Information Retrieval (SIGIR),80.18,ACM,Explainable Recommender
https://doi.org/10.1145/3404835.3462847,User-Centric Path Reasoning towards Explainable Recommendation,"Chang-You Tai, Liang-Ying Huang,  + 2",2021,SIGIR '21: Proceedings of the 44th International ACM SIGIR Conference on Research and Development in Information Retrieval,International ACM SIGIR Conference on Research and Development in Information Retrieval (SIGIR),80.18,ACM,Explainable Recommender
https://doi.org/10.1145/3539597.3570391,Cognition-aware Knowledge Graph Reasoning for Explainable Recommendation,"Qingyu Bing, Qiannan Zhu, Zhicheng Dou",2023,WSDM '23: Proceedings of the Sixteenth ACM International Conference on Web Search and Data Mining,ACM International Conference on Web Search and Data Mining (WSDM),71.60,ACM,Explainable Recommender
https://doi.org/10.1145/3397271.3401171,Leveraging Demonstrations for Reinforcement Recommendation Reasoning over Knowledge Graphs,"Kangzhi Zhao, Xiting Wang,  + 5",2020,SIGIR '20: Proceedings of the 43rd International ACM SIGIR Conference on Research and Development in Information Retrieval,International ACM SIGIR Conference on Research and Development in Information Retrieval (SIGIR),80.18,ACM,Explainable Recommender
https://doi.org/10.1145/3531267,Time-aware Path Reasoning on Knowledge Graph for Recommendation,"Yuyue Zhao, Xiang Wang,  + 5",26,ACM Transactions on Information Systems (TOIS),ACM Transactions on Information Systems,91.76,ACM,Explainable Recommender
https://doi.org/10.1145/3437963.3441726,Explanation as a Defense of Recommendation,"Aobo Yang, Nan Wang, Hongbo Deng,  + 1",2021,WSDM '21: Proceedings of the 14th ACM International Conference on Web Search and Data Mining,ACM International Conference on Web Search and Data Mining (WSDM),73.89,ACM,Explainable Recommender
https://doi.org/10.1145/3565480,User Perception of Recommendation Explanation: Are Your Explanations What Users Need?,"Hongyu Lu, Weizhi Ma, Yifan Wang,  + 5",48,ACM Transactions on Information Systems (TOIS),ACM Transactions on Information Systems,91.76,ACM,Explainable Recommender
https://doi.org/10.1145/3209978.3210010,Explainable Recommendation via Multi-Task Learning in Opinionated Text Data,"Nan Wang, Hongning Wang,  + 2",2018,SIGIR '18: The 41st International ACM SIGIR Conference on Research & Development in Information Retrieval,International ACM SIGIR Conference on Research and Development in Information Retrieval (SIGIR),84.00,ACM,Explainable Recommender
https://doi.org/10.1145/3539618.3591753,RCENR: A Reinforced and Contrastive Heterogeneous Network Reasoning Model for Explainable News Recommendation,"Hao Jiang, Chuanzhen Li, Juanjuan Cai,  + 1",2023,SIGIR '23: Proceedings of the 46th International ACM SIGIR Conference on Research and Development in Information Retrieval,International ACM SIGIR Conference on Research and Development in Information Retrieval (SIGIR),80.18,ACM,Explainable Recommender
https://doi.org/10.1145/3331184.3331244,The FacT: Taming Latent Factor Models for Explainability with Factorization Trees,"Yiyi Tao, Yiling Jia, Nan Wang,  + 1",2019,SIGIR'19: Proceedings of the 42nd International ACM SIGIR Conference on Research and Development in Information Retrieval,International ACM SIGIR Conference on Research and Development in Information Retrieval (SIGIR),80.56,ACM,Explainable Recommender
https://doi.org/10.1145/3580488,Personalized Prompt Learning for Explainable Recommendation,"Lei Li, Yongfeng Zhang, Li Chen",103,ACM Transactions on Information Systems (TOIS),ACM Transactions on Information Systems,91.76,ACM,Explainable Recommender
https://doi.org/10.1145/3511019,KR-GCN: Knowledge-Aware Reasoning with Graph Convolution Network for Explainable Recommendation,"Ting Ma, Longtao Huang,  + 2",4,ACM Transactions on Information Systems (TOIS),ACM Transactions on Information Systems,91.76,ACM,Explainable Recommender
https://doi.org/10.1145/3477495.3531674,RecDelta: An Interactive Dashboard on Top-k Recommendation for Cross-model Evaluation,"Yi-Shyuan Chiang, Yu-Ze Liu,  + 4",2022,SIGIR '22: Proceedings of the 45th International ACM SIGIR Conference on Research and Development in Information Retrieval,International ACM SIGIR Conference on Research and Development in Information Retrieval (SIGIR),80.18,ACM,Explainable Recommender
https://doi.org/10.1145/3397271.3401137,Disentangled Graph Collaborative Filtering,"Xiang Wang, Hongye Jin, An Zhang,  + 3",2020,SIGIR '20: Proceedings of the 43rd International ACM SIGIR Conference on Research and Development in Information Retrieval,International ACM SIGIR Conference on Research and Development in Information Retrieval (SIGIR),80.18,ACM,Explainable Recommender
https://doi.org/10.1145/3336191.3371790,Distilling Structured Knowledge into Embeddings for Explainable and Accurate Recommendation,"Yuan Zhang, Xiaoran Xu, Hanning Zhou, Yan Zhang",2020,WSDM '20: Proceedings of the 13th International Conference on Web Search and Data Mining,ACM International Conference on Web Search and Data Mining (WSDM),73.20,ACM,Explainable Recommender
https://doi.org/10.1145/3473973,Graph Neural Collaborative Topic Model for Citation Recommendation,"Qianqian Xie, Yutao Zhu, Jimin Huang, Pan Du, Jian-Yun Nie",48,ACM Transactions on Information Systems (TOIS),ACM Transactions on Information Systems,91.76,ACM,Explainable Recommender
https://doi.org/10.1145/3291060,MMALFM: Explainable Recommendation by Leveraging Reviews and Images,"Zhiyong Cheng, Xiaojun Chang, Lei Zhu, Rose C. Kanjirathinkal, Mohan Kankanhalli",16,ACM Transactions on Information Systems (TOIS),ACM Transactions on Information Systems,91.76,ACM,Explainable Recommender
https://doi.org/10.1145/3477495.3532041,"Post Processing Recommender Systems with Knowledge Graphs for Recency, Popularity, and Diversity of Explanations","Giacomo Balloccu, Ludovico Boratto,  + 2",2022,SIGIR '22: Proceedings of the 45th International ACM SIGIR Conference on Research and Development in Information Retrieval,International ACM SIGIR Conference on Research and Development in Information Retrieval (SIGIR),80.18,ACM,Explainable Recommender
https://doi.org/10.1145/3437963.3441812,Mining the Stars: Learning Quality Ratings with User-facing Explanations for Vacation Rentals,"Anastasiia Kornilova, Lucas Bernardi",2021,WSDM '21: Proceedings of the 14th ACM International Conference on Web Search and Data Mining,ACM International Conference on Web Search and Data Mining (WSDM),73.89,ACM,Explainable Recommender
https://doi.org/10.1145/3289600.3290960,Representation Interpretation with Spatial Encoding and Multimodal Analytics,"Ninghao Liu, Mengnan Du, Xia Hu",2019,WSDM '19: Proceedings of the Twelfth ACM International Conference on Web Search and Data Mining,ACM International Conference on Web Search and Data Mining (WSDM),72.50,ACM,Explainable Recommender
https://doi.org/10.1145/3372923.3404800,You Do Not Decide for Me! Evaluating Explainable Group Aggregation Strategies for Tourism,"Shabnam Najafian, Daniel Herzog,  + 3",2020,HT '20: Proceedings of the 31st ACM Conference on Hypertext and Social Media,ACM Conference on Hypertext and Social Media (HT),70.40,ACM,Explainable Recommender
https://doi.org/10.1145/3477495.3531681,Improving Fairness and Transparency for Artists in Music Recommender Systems,Karlijn Dinnissen,2022,SIGIR '22: Proceedings of the 45th International ACM SIGIR Conference on Research and Development in Information Retrieval,International ACM SIGIR Conference on Research and Development in Information Retrieval (SIGIR),80.18,ACM,Explainable Recommender
https://doi.org/10.1145/3603163.3609054,Adaptive Navigational Support and Explainable Recommendations in a Personalized Programming Practice System,"Jordan Barria-Pineda,  + 2",2023,HT '23: Proceedings of the 34th ACM Conference on Hypertext and Social Media,ACM Conference on Hypertext and Social Media (HT),70.40,ACM,Explainable Recommender
https://doi.org/10.1145/3581930,Examining the User Evaluation of Multi-List Recommender Interfaces in the Context of Healthy Recipe Choices,"Alain D. Starke, Edis Asotic,  + 2",18,ACM Transactions on Recommender Systems (TORS),ACM Conference On Recommender Systems (RecSys),73.91,ACM,Explainable Recommender
https://doi.org/10.1145/3539597.3570414,MUSENET: Multi-Scenario Learning for Repeat-Aware Personalized Recommendation,"Senrong Xu, Liangyue Li, Yuan Yao,  + 4",2023,WSDM '23: Proceedings of the Sixteenth ACM International Conference on Web Search and Data Mining,ACM International Conference on Web Search and Data Mining (WSDM),71.60,ACM,Explainable Recommender
https://doi.org/10.1145/3292500.3330857,Incorporating Interpretability into Latent Factor Models via Fast Influence Analysis,"Weiyu Cheng, Yanyan Shen,  + 2",2019,KDD '19: Proceedings of the 25th ACM SIGKDD International Conference on Knowledge Discovery & Data Mining,International Conference on Knowledge Discovery & Data Mining (KDD),70.93,ACM,Explainable Recommender
https://doi.org/10.1145/3604776,Trustworthy Recommendation and Search: Introduction to the Special Section - Part 2,"Hongzhi Yin, Yizhou Sun,  + 2",82,ACM Transactions on Information Systems (TOIS),ACM Transactions on Information Systems,91.76,ACM,Explainable Recommender
https://doi.org/10.1145/3579995,Trustworthy Recommendation and Search: Introduction to the Special Issue - Part 1,"Hongzhi Yin, Yizhou Sun, Guandong Xu,  + 1",51,ACM Transactions on Information Systems (TOIS),ACM Transactions on Information Systems,91.76,ACM,Explainable Recommender
https://doi.org/10.1145/3579541,Explaining Recommendations through Conversations: Dialog Model and the Effects of Interface Type and Degree of Interactivity,"Diana C. Hernandez-Bocanegra, Jürgen Ziegler",6,ACM Transactions on Interactive Intelligent Systems (TIIS),ACM Transactions on Information Systems,72.16,ACM,Explainable Recommender
https://doi.org/10.1145/3539597.3572723,Trustworthy Algorithmic Ranking Systems,"Markus Schedl, Emilia Gómez, Elisabeth Lex",2023,WSDM '23: Proceedings of the Sixteenth ACM International Conference on Web Search and Data Mining,ACM International Conference on Web Search and Data Mining (WSDM),71.60,ACM,Explainable Recommender
https://doi.org/10.1145/3282878,User Evaluations on Sentiment-based Recommendation Explanations,"Li Chen, Dongning Yan, Feng Wang",20,ACM Transactions on Interactive Intelligent Systems (TIIS),ACM Transactions on Information Systems,72.16,ACM,Explainable Recommender
https://doi.org/10.1145/3437963.3441657,Personalization in Practice: Methods and Applications,"Dmitri Goldenberg, Kostia Kofman,  + 4",2021,WSDM '21: Proceedings of the 14th ACM International Conference on Web Search and Data Mining,ACM International Conference on Web Search and Data Mining (WSDM),73.89,ACM,Explainable Recommender
https://doi.org/10.1145/3209978.3210083,Attention-driven Factor Model for Explainable Personalized Recommendation,"Jingwu Chen, Fuzhen Zhuang,  + 4",2018,SIGIR '18: The 41st International ACM SIGIR Conference on Research & Development in Information Retrieval,International ACM SIGIR Conference on Research and Development in Information Retrieval (SIGIR),84.00,ACM,Explainable Recommender
https://doi.org/10.1145/3289600.3290609,NAIRS: A Neural Attentive Interpretable Recommendation System,"Shuai Yu, Yongbo Wang, Min Yang,  + 3",2019,WSDM '19: Proceedings of the Twelfth ACM International Conference on Web Search and Data Mining,ACM International Conference on Web Search and Data Mining (WSDM),72.50,ACM,Explainable Recommender
https://doi.org/10.1145/3397271.3401032,Measuring Recommendation Explanation Quality: The Conflicting Goals of Explanations,"Krisztian Balog, Filip Radlinski",2020,SIGIR '20: Proceedings of the 43rd International ACM SIGIR Conference on Research and Development in Information Retrieval,International ACM SIGIR Conference on Research and Development in Information Retrieval (SIGIR),80.18,ACM,Explainable Recommender
https://doi.org/10.1145/3404835.3463005,Counterfactual Explanations for Neural Recommenders,"Khanh Hiep Tran, Azin Ghazimatin,  + 1",2021,SIGIR '21: Proceedings of the 44th International ACM SIGIR Conference on Research and Development in Information Retrieval,International ACM SIGIR Conference on Research and Development in Information Retrieval (SIGIR),80.18,ACM,Explainable Recommender
https://doi.org/10.1145/3397271.3401468,EARS 2020: The 3rd International Workshop on ExplainAble Recommendation and Search,"Yongfeng Zhang, Xu Chen, Yi Zhang,  + 2",2020,SIGIR '20: Proceedings of the 43rd International ACM SIGIR Conference on Research and Development in Information Retrieval,International ACM SIGIR Conference on Research and Development in Information Retrieval (SIGIR),80.18,ACM,Explainable Recommender
https://doi.org/10.1145/3331184.3331211,"Transparent, Scrutable and Explainable User Models for Personalized Recommendation","Krisztian Balog, Filip Radlinski,  + 1",2019,SIGIR'19: Proceedings of the 42nd International ACM SIGIR Conference on Research and Development in Information Retrieval,International ACM SIGIR Conference on Research and Development in Information Retrieval (SIGIR),80.56,ACM,Explainable Recommender
https://doi.org/10.1145/3331184.3331203,Reinforcement Knowledge Graph Reasoning for Explainable Recommendation,"Yikun Xian, Zuohui Fu,  + 3",2019,SIGIR'19: Proceedings of the 42nd International ACM SIGIR Conference on Research and Development in Information Retrieval,International ACM SIGIR Conference on Research and Development in Information Retrieval (SIGIR),80.56,ACM,Explainable Recommender
https://doi.org/10.1145/3465336.3475104,Exploring User Concerns about Disclosing Location and Emotion Information in Group Recommendations,"Shabnam Najafian, Tim Draws,  + 4",2021,HT '21: Proceedings of the 32nd ACM Conference on Hypertext and Social Media,ACM Conference on Hypertext and Social Media (HT),70.40,ACM,Explainable Recommender
https://doi.org/10.1145/3397271.3401451,Explaining Recommendations in Heterogeneous Networks,Azin Ghazimatin,2020,SIGIR '20: Proceedings of the 43rd International ACM SIGIR Conference on Research and Development in Information Retrieval,International ACM SIGIR Conference on Research and Development in Information Retrieval (SIGIR),80.18,ACM,Explainable Recommender
https://doi.org/10.1145/3477495.3531800,Progressive Self-Attention Network with Unsymmetrical Positional Encoding for Sequential Recommendation,"Yuehua Zhu, Bo Huang,  + 4",2022,SIGIR '22: Proceedings of the 45th International ACM SIGIR Conference on Research and Development in Information Retrieval,International ACM SIGIR Conference on Research and Development in Information Retrieval (SIGIR),80.18,ACM,Explainable Recommender
https://doi.org/10.1145/3397271.3401042,Try This Instead: Personalized and Interpretable Substitute Recommendation,"Tong Chen, Hongzhi Yin, Guanhua Ye, Zi Huang, Yang Wang, Meng Wang",2020,SIGIR '20: Proceedings of the 43rd International ACM SIGIR Conference on Research and Development in Information Retrieval,International ACM SIGIR Conference on Research and Development in Information Retrieval (SIGIR),80.18,ACM,Explainable Recommender
https://doi.org/10.1145/3579363,Directive Explanations for Actionable Explainability in Machine Learning Applications,"Ronal Singh, Tim Miller, Henrietta Lyons, Liz Sonenberg, Eduardo Velloso, Frank Vetere, Piers Howe, Paul Dourish",23,ACM Transactions on Interactive Intelligent Systems (TIIS),ACM Transactions on Information Systems,72.16,ACM,Explainable Recommender
