https://ieeexplore.ieee.org/document/10138095/,Routing User-Interest Markov Tree for Scalable Personalized Knowledge-Aware Recommendation,Yongsen Zheng;Pengxu Wei;Ziliang Chen;Chengpei Tang;Liang Lin,2023,IEEE Transactions on Neural Networks and Learning Systems,IEEE Transactions on Neural Networks and Learning Systems,100.00,IEEE,Explainable Recommender
https://ieeexplore.ieee.org/document/10272645/,Rule-guided Counterfactual Explainable Recommendation,Yinwei Wei;Xiaoyang Qu;Xiang Wang;Yunshan Ma;Liqiang Nie;Tat-Seng Chua,2023,IEEE Transactions on Knowledge and Data Engineering,IEEE Transactions on Knowledge and Data Engineering,100.00,IEEE,Explainable Recommender
https://ieeexplore.ieee.org/document/10330074/,Reason Generation for Point of Interest Recommendation via a Hierarchical Attention-based Transformer Model,Yuxia Wu;Guoshuai Zhao;Mingdi Li;Zhuocheng Zhang;Xueming Qian,2023,IEEE Transactions on Multimedia,IEEE Transactions on Multimedia,100.00,IEEE,Explainable Recommender
https://sciencedirect.com/science/article/pii/S0950705123000084,Scalable and explainable visually-aware recommender systems,"Thanet Markchom, Huizhi Liang, James Ferryman",2023,Knowledge-Based Systems,Knowledge-Based Systems,100.00,sciencedirect,Explainable Recommender
https://sciencedirect.com/science/article/pii/S1389041722000456,"DEGARI 2.0: A diversity-seeking, explainable, and affective art recommender for social inclusion","Antonio Lieto, Gian Luca Pozzato, Rossana Damiano",2022,Cognitive Systems Research,Cognitive Systems Research,100.00,sciencedirect,Explainable Recommender
https://sciencedirect.com/science/article/pii/S0957417422022497,Machine assistance for credit approval? Random wheel can recommend and explain,"Anupam Khan, Soumya K. Ghosh",2022,Expert Systems with Applications,Expert Systems with Applications,100.00,sciencedirect,Explainable Recommender
https://sciencedirect.com/science/article/pii/S0957417422001920,AENAR: An aspect-aware explainable neural attentional recommender model for rating predication,"Tianwei Zhang, Chuanhou Sun, Xiangjun Dong",2022,Expert Systems with Applications,Expert Systems with Applications,100.00,sciencedirect,Explainable Recommender
https://sciencedirect.com/science/article/pii/S0306457321001503,Explaining recommender systems fairness and accuracy through the lens of data characteristics,"Yashar Deldjoo, Alejandro Bellogin, Tommaso Di Noia",2021,Information Processing & Management,Information Procesing and Management,92.96,sciencedirect,Explainable Recommender
https://sciencedirect.com/science/article/pii/S1566253521000178,"A survey of recommender systems for energy efficiency in buildings: Principles, challenges and prospects","Yassine Himeur, Abdullah Alsalemi, Iraklis Varlamis",2021,Information Fusion,Information Fusion,100.00,sciencedirect,Explainable Recommender
https://sciencedirect.com/science/article/pii/S0950705122004622,A survey for trust-aware recommender systems: A deep learning perspective,"Manqing Dong, Feng Yuan, Liming Zhu",2022,Knowledge-Based Systems,Knowledge-Based Systems,100.00,sciencedirect,Explainable Recommender
https://sciencedirect.com/science/article/pii/S0959652621039615,Techno-economic assessment of building energy efficiency systems using behavioral change: A case study of an edge-based micro-moments solution,"Yassine Himeur, Abdullah Alsalemi, George Dimitrakopoulos",2021,Journal of Cleaner Production,Journal of Cleaner Production,100.00,sciencedirect,Explainable Recommender
https://sciencedirect.com/science/article/pii/S1568494623001370,Explainable AI in big data intelligence of community detection for digitalization e-healthcare services,"Arun Kumar Sangaiah, Samira Rezaei, Weizhe Zhang",2023,Applied Soft Computing,Applied Soft Computing,100.00,sciencedirect,Explainable Recommender
https://sciencedirect.com/science/article/pii/S0169023X1830332X,Personalised novel and explainable matrix factorisation,"Ludovik Coba, Panagiotis Symeonidis, Markus Zanker",2019,Data & Knowledge Engineering,Data & Knowledge Engineering,100.00,sciencedirect,Explainable Recommender
https://sciencedirect.com/science/article/pii/S095741742200450X,Explicable recommendation based on knowledge graph,"Xingjuan Cai, Lijie Xie, Zhihua Cui",2022,Expert Systems with Applications,Expert Systems with Applications,100.00,sciencedirect,Explainable Recommender
https://sciencedirect.com/science/article/pii/S0020025521002413,IR-Rec: An interpretive rules-guided recommendation over knowledge graph,"Jiaying Chen, Jiong Yu, Ping Li",2021,Information Sciences,Information Sciences,100.00,sciencedirect,Explainable Recommender
https://sciencedirect.com/science/article/pii/S0957417419303951,Sentiment based matrix factorization with reliability for recommendation,"Rong-Ping Shen, Heng-Ru Zhang, Fan Min",2019,Expert Systems with Applications,Expert Systems with Applications,100.00,sciencedirect,Explainable Recommender
https://sciencedirect.com/science/article/pii/S0167404822001419,Latest trends of security and privacy in recommender systems: A comprehensive review and future perspectives,"Yassine Himeur, Shahab Saquib Sohail, Mamoun Alazab",2022,Computers & Security,Computers & Security (Elsevier),78.43,sciencedirect,Explainable Recommender
https://sciencedirect.com/science/article/pii/S037877882030815X,"Building power consumption datasets: Survey, taxonomy and future directions","Yassine Himeur, Abdullah Alsalemi, Abbes Amira",2020,Energy and Buildings,Energy and Buildings,100.00,sciencedirect,Explainable Recommender
https://sciencedirect.com/science/article/pii/S0957417421013865,Evolving context-aware recommender systems with users in mind,"Amit Livne, Eliad Shem Tov, Lior Rokach",2021,Expert Systems with Applications,Expert Systems with Applications,100.00,sciencedirect,Explainable Recommender
https://sciencedirect.com/science/article/pii/S0040162523000288,How should the results of artificial intelligence be explained to users? - Research on consumer preferences in user-centered explainable artificial intelligence,"Doha Kim, Yeosol Song, Daeho Lee",2023,Technological Forecasting and Social Change,Technological Forecasting and Social Change,100.00,sciencedirect,Explainable Recommender
https://sciencedirect.com/science/article/pii/S0957417420305303,ReEx: An integrated architecture for preference model representation and explanation,"Farhad Zafari, Irene Moser, Timos Sellis",2020,Expert Systems with Applications,Expert Systems with Applications,100.00,sciencedirect,Explainable Recommender
https://sciencedirect.com/science/article/pii/S0957417418306158,An explainable multi-attribute decision model based on argumentation,"Qiaoting Zhong, Xiuyi Fan, Francesca Toni",2019,Expert Systems with Applications,Expert Systems with Applications,100.00,sciencedirect,Explainable Recommender
https://sciencedirect.com/science/article/pii/S0020025521002772,TAERT: Triple-Attentional Explainable Recommendation with Temporal Convolutional Network,"Siyuan Guo, Ying Wang, Xin Wang",2021,Information Sciences,Information Sciences,100.00,sciencedirect,Explainable Recommender
https://sciencedirect.com/science/article/pii/S0020025520300931,Towards explainable personalized recommendations by learning from users’ photos,"Jorge Díez, Pablo Pérez-Núñez, Antonio Bahamonde",2020,Information Sciences,Information Sciences,100.00,sciencedirect,Explainable Recommender
https://sciencedirect.com/science/article/pii/S1687428523000298,"Taxonomic and functional diversity of macroinvertebrates in sediment and macrophyte habitats: A case study, the Ibrahimia Canal, Nile River, Egypt","Reda E. Bendary, Mohamed E. Goher, Amr S. El-Shamy",2023,The Egyptian Journal of Aquatic Research,European Journal of Operational Research,70.00,sciencedirect,Explainable Recommender
https://sciencedirect.com/science/article/pii/S0022480421004364,The Association Between Risk Aversion of Surgeons and Their Clinical Decision-Making,"Greg D. Sacks, Aaron J. Dawes, Susan L. Ettner",2021,Journal of Surgical Research,European Journal of Operational Research,70.59,sciencedirect,Explainable Recommender
https://sciencedirect.com/science/article/pii/S0020025518307667,EXPLORE: EXPLainable item-tag CO-REcommendation,"Xiaolin Zheng, Menghan Wang, Zhehao Cheng",2019,Information Sciences,Information Sciences,100.00,sciencedirect,Explainable Recommender
https://sciencedirect.com/science/article/pii/S0957417418303270,Predicting process behavior meets factorization machines,"Wai Lam Jonathan Lee, Denis Parra, Marcos Sepúlveda",2018,Expert Systems with Applications,Expert Systems with Applications,100.00,sciencedirect,Explainable Recommender
https://sciencedirect.com/science/article/pii/S0747563223002194,Determinants of physicians’ intention to use AI-assisted diagnosis: An integrated readiness perspective,Pi-Jung Hsieh,2023,Computers in Human Behavior,Computers in Human Behavior,100.00,sciencedirect,Explainable Recommender
https://sciencedirect.com/science/article/pii/S0362028X22054357,Consumer Knowledge and Behaviors Regarding Food Safety Risks Associated with Wheat Flour,"Yaohua Feng, Juan C. Archila-Godínez",2021,Journal of Food Protection,Journal of Cleaner Production,72.73,sciencedirect,Explainable Recommender
https://sciencedirect.com/science/article/pii/S0959652620330638,Evaluating collaborative consumption platforms from a consumer perspective,"Tiago Oliveira, Shailendra Tomar, Carlos Tam",2020,Journal of Cleaner Production,Journal of Cleaner Production,100.00,sciencedirect,Explainable Recommender
https://sciencedirect.com/science/article/pii/S0950705121010959,An explainable recommendation framework based on an improved knowledge graph attention network with massive volumes of side information,"Ryotaro Shimizu, Megumi Matsutani, Masayuki Goto",2021,Knowledge-Based Systems,Knowledge-Based Systems,100.00,sciencedirect,Explainable Recommender
https://sciencedirect.com/science/article/pii/S0957417423008497,I am all EARS: Using open data and knowledge graph embeddings for music recommendations,"Niels Bertram, Jürgen Dunkel, Ramón Hermoso",2023,Expert Systems with Applications,Expert Systems with Applications,100.00,sciencedirect,Explainable Recommender
https://sciencedirect.com/science/article/pii/S0950705122011947,Reinforcement recommendation reasoning through knowledge graphs for explanation path quality,"Giacomo Balloccu, Ludovico Boratto, Mirko Marras",2022,Knowledge-Based Systems,Knowledge-Based Systems,100.00,sciencedirect,Explainable Recommender
https://sciencedirect.com/science/article/pii/S0747563220302375,An international systematic review of cyberbullying measurements,"JongSerl Chun, Jungup Lee, Serim Lee",2020,Computers in Human Behavior,Computers in Human Behavior,100.00,sciencedirect,Explainable Recommender
https://sciencedirect.com/science/article/pii/S0957417422009903,"The role of context fusion on accuracy, beyond-accuracy, and fairness of point-of-interest recommendation systems","Hossein A. Rahmani, Yashar Deldjoo, Tommaso di Noia",2022,Expert Systems with Applications,Expert Systems with Applications,100.00,sciencedirect,Explainable Recommender
https://sciencedirect.com/science/article/pii/S0306457319301761,Dynamic attention-based explainable recommendation with textual and visual fusion,"Peng Liu, Lemei Zhang, Jon Atle Gulla",2019,Information Processing & Management,Information Procesing and Management,92.96,sciencedirect,Explainable Recommender
https://sciencedirect.com/science/article/pii/S0747563223001176,Videogame player experiences with micro-transactions: An interpretative phenomenological analysis,"Erin Gibson, Mark D. Griffiths, Andrew Harris",2023,Computers in Human Behavior,Computers in Human Behavior,100.00,sciencedirect,Explainable Recommender
https://sciencedirect.com/science/article/pii/S0950705122006682,Balancing the trade-off between accuracy and diversity in recommender systems with personalized explanations based on Linked Open Data,"André Levi Zanon, Leonardo Chaves Dutra da Rocha, Marcelo Garcia Manzato",2022,Knowledge-Based Systems,Knowledge-Based Systems,100.00,sciencedirect,Explainable Recommender
https://sciencedirect.com/science/article/pii/S0893608022004087,ExpGCN: Review-aware Graph Convolution Network for explainable recommendation,"Tianjun Wei, Tommy W. S. Chow, Mingbo Zhao",2022,Neural Networks,Neural Networks,100.00,sciencedirect,Explainable Recommender
https://sciencedirect.com/science/article/pii/S1071581918300946,Linked open data-based explanations for transparent recommender systems,"Cataldo Musto, Fedelucio Narducci, Giovanni Semeraro",2019,International Journal of Human-Computer Studies,International Journal of Human-Computer Studies (IJHCS),92.16,sciencedirect,Explainable Recommender
https://sciencedirect.com/science/article/pii/S0022030220307128,Optimizing genomic prediction model given causal genes in a dairy cattle population,"Jinyan Teng, Shuwen Huang, Zhe Zhang",2020,Journal of Dairy Science,Journal of Information Science,77.78,sciencedirect,Explainable Recommender
https://sciencedirect.com/science/article/pii/S2667305322000941,An effective explainable food recommendation using deep image clustering and community detection,"Mehrdad Rostami, Usman Muhammad, Mourad Oussalah",2022,Intelligent Systems with Applications,Expert Systems with Applications,81.16,sciencedirect,Explainable Recommender
https://sciencedirect.com/science/article/pii/S0950705120308169,Accurate and Explainable Recommendation via Hierarchical Attention Network Oriented Towards Crowd Intelligence,"Chao Yang, Weixin Zhou, Huawei Shen",2020,Knowledge-Based Systems,Knowledge-Based Systems,100.00,sciencedirect,Explainable Recommender
https://sciencedirect.com/science/article/pii/S0020025522012117,Interpretable click-through rate prediction through distillation of the neural additive factorization model,"Aljo Jose, Sujala D. Shetty",2022,Information Sciences,Information Sciences,100.00,sciencedirect,Explainable Recommender
https://sciencedirect.com/science/article/pii/S0950705122006050,Exploring post-hoc agnostic models for explainable cooking recipe recommendations,"Raciel Yera, Ahmad A. Alzahrani, Luis Martínez",2022,Knowledge-Based Systems,Knowledge-Based Systems,100.00,sciencedirect,Explainable Recommender
https://sciencedirect.com/science/article/pii/S0950705123006044,KGTN: Knowledge Graph Transformer Network for explainable multi-category item recommendation,"Chao Chang, Junming Zhou, Yong Tang",2023,Knowledge-Based Systems,Knowledge-Based Systems,100.00,sciencedirect,Explainable Recommender
https://sciencedirect.com/science/article/pii/S095965262303250X,Towards critical low-temperature relaxation indicators for effective rejuvenation efficiency evaluation of rejuvenator-aged bitumen blends,"Shisong Ren, Xueyan Liu, Sandra Erkens",2023,Journal of Cleaner Production,Journal of Cleaner Production,100.00,sciencedirect,Explainable Recommender
https://sciencedirect.com/science/article/pii/S1568494623003940,Probabilistic safety risk assessment in large-diameter tunnel construction using an interactive and explainable tree-based pipeline optimization method,"Penghui Lin, Maozhi Wu, Limao Zhang",2023,Applied Soft Computing,Applied Soft Computing,100.00,sciencedirect,Explainable Recommender
https://sciencedirect.com/science/article/pii/S0959652622015232,An improved typhoon risk model coupled with mitigation capacity and its relationship to disaster losses,"Fangtian Liu, Erqi Xu, Hongqi Zhang",2022,Journal of Cleaner Production,Journal of Cleaner Production,100.00,sciencedirect,Explainable Recommender
https://sciencedirect.com/science/article/pii/S0950705123004094,Sapling Similarity: A performing and interpretable memory-based tool for recommendation,"Giambattista Albora, Lavinia Rossi Mori, Andrea Zaccaria",2023,Knowledge-Based Systems,Knowledge-Based Systems,100.00,sciencedirect,Explainable Recommender
https://sciencedirect.com/science/article/pii/S0950705123005804,A user-centred evaluation of DisCERN: Discovering counterfactuals for code vulnerability detection and correction,"Anjana Wijekoon, Nirmalie Wiratunga",2023,Knowledge-Based Systems,Knowledge-Based Systems,100.00,sciencedirect,Explainable Recommender
https://sciencedirect.com/science/article/pii/S1071581920301531,"The effects of explainability and causability on perception, trust, and acceptance: Implications for explainable AI",Donghee Shin,2020,International Journal of Human-Computer Studies,International Journal of Human-Computer Studies (IJHCS),92.16,sciencedirect,Explainable Recommender
https://sciencedirect.com/science/article/pii/S002248042200467X,Directed Acyclic Graphs in Surgical Research,"AlleaBelle Gongola, Jace C. Bradshaw",2022,Journal of Surgical Research,European Journal of Operational Research,70.59,sciencedirect,Explainable Recommender
https://sciencedirect.com/science/article/pii/S0040162521008088,The micro-foundations of conflicts in joint university-industry laboratories,"Dhruba Borah, Paul Ellwood",2021,Technological Forecasting and Social Change,Technological Forecasting and Social Change,100.00,sciencedirect,Explainable Recommender
https://sciencedirect.com/science/article/pii/S0925231221010821,Path-based reasoning over heterogeneous networks for recommendation via bidirectional modeling,"Junwei Zhang, Min Gao, Qingyu Xiong",2021,Neurocomputing,Neurocomputing (Amsterdam),70.00,sciencedirect,Explainable Recommender
https://sciencedirect.com/science/article/pii/S0957417421015232,Semantic and explainable research-related recommendation system based on semi-supervised methodology using BERT and LDA models,"Nakyeong Yang, Jeongje Jo, Juyoung Kang",2021,Expert Systems with Applications,Expert Systems with Applications,100.00,sciencedirect,Explainable Recommender
https://sciencedirect.com/science/article/pii/S0306457321001230,Heterogeneous type-specific entity representation learning for recommendations in e-commerce network,"Jianxing Zheng, Qinwen Li, Jian Liao",2021,Information Processing & Management,Information Procesing and Management,92.96,sciencedirect,Explainable Recommender
https://sciencedirect.com/science/article/pii/S0020025522002092,Attention-based explainable friend link prediction with heterogeneous context information,"Jianxing Zheng, Zifeng Qin, Deyu Li",2022,Information Sciences,Information Sciences,100.00,sciencedirect,Explainable Recommender
https://sciencedirect.com/science/article/pii/S0747563223001279,What is the reported relationship between self-esteem and gaming disorder? A systematic review and meta-analysis,"Michael Kavanagh, Charlotte Brett, Catherine Brignell",2023,Computers in Human Behavior,Computers in Human Behavior,100.00,sciencedirect,Explainable Recommender
https://sciencedirect.com/science/article/pii/S1877750317307524,Assigning reliability values to recommendations using matrix factorization,"B. Zhu, F. Ortega, A. Gutiérrez",2018,Journal of Computational Science,Journal of Information Science,83.87,sciencedirect,Explainable Recommender
https://sciencedirect.com/science/article/pii/S0950705117305075,Characterizing context-aware recommender systems: A systematic literature review,"Norha M. Villegas, Cristian Sánchez, Gabriel Tamura",2018,Knowledge-Based Systems,Knowledge-Based Systems,100.00,sciencedirect,Explainable Recommender
https://sciencedirect.com/science/article/pii/S0957417422024393,SARWAS: Deep ensemble learning techniques for sentiment based recommendation system,"Chaitali Choudhary, Inder Singh, Manoj Kumar",2022,Expert Systems with Applications,Expert Systems with Applications,100.00,sciencedirect,Explainable Recommender
https://sciencedirect.com/science/article/pii/S1361841522003127,Guidelines and evaluation of clinical explainable AI in medical image analysis,"Weina Jin, Xiaoxiao Li, Ghassan Hamarneh",2022,Medical Image Analysis,Medical Image Analysis,100.00,sciencedirect,Explainable Recommender
https://sciencedirect.com/science/article/pii/S0378779623004728,Transient overvoltage transfer and amplification in a 400 kV network – A case study,"S. K. E. Awadallah, S. Mohanty, F. Ghassemi",2023,Electric Power Systems Research,Cognitive Systems Research,70.18,sciencedirect,Explainable Recommender
https://sciencedirect.com/science/article/pii/S0306437922000254,Preference-based and local post-hoc explanations for recommender systems,"Léo Brunot, Nicolas Canovas, Willème Verdeaux",2022,Information Systems,Information Sciences,76.92,sciencedirect,Explainable Recommender
https://sciencedirect.com/science/article/pii/S0959652622053720,Efficient detection and treatment of pharmaceutical contaminants to produce clean water for better health and environmental,"Mokgehle R. Letsoalo, Thandiwe Sithole, Tebogo Mashifana",2022,Journal of Cleaner Production,Journal of Cleaner Production,100.00,sciencedirect,Explainable Recommender
https://sciencedirect.com/science/article/pii/S0957417422001543,Multi-Armed Bandits in Recommendation Systems: A survey of the state-of-the-art and future directions,"Nícollas Silva, Heitor Werneck, Leonardo Rocha",2022,Expert Systems with Applications,Expert Systems with Applications,100.00,sciencedirect,Explainable Recommender
https://sciencedirect.com/science/article/pii/S0950705120304196,HAGERec: Hierarchical Attention Graph Convolutional Network Incorporating Knowledge Graph for Explainable Recommendation,"Zuoxi Yang, Shoubin Dong",2020,Knowledge-Based Systems,Knowledge-Based Systems,100.00,sciencedirect,Explainable Recommender
https://sciencedirect.com/science/article/pii/S0306457321000285,Bias-Aware Hierarchical Clustering for detecting the discriminated groups of users in recommendation systems,"Joanna Misztal-Radecka, Bipin Indurkhya",2021,Information Processing & Management,Information Procesing and Management,92.96,sciencedirect,Explainable Recommender
https://sciencedirect.com/science/article/pii/S095741742200690X,Neural stylist: Towards online styling service,"Dongmei Mo, Xingxing Zou, WaiKeung Wong",2022,Expert Systems with Applications,Expert Systems with Applications,100.00,sciencedirect,Explainable Recommender
https://sciencedirect.com/science/article/pii/S0377042720303071,Joint modeling of longitudinal and time-to-event data on multivariate protein biomarkers,"Abin Thomas, Gajendra K. Vishwakarma, Atanu Bhattacharjee",2020,Journal of Computational and Applied Mathematics,Journal of Computational and Applied Mathematics,100.00,sciencedirect,Explainable Recommender
https://sciencedirect.com/science/article/pii/S016792362300221X,Modeling interaction behavior and preference decline for live stream recommendation,"Jiawei Chen, Hongyan Liu",2023,Decision Support Systems,Decision Support Systems,100.00,sciencedirect,Explainable Recommender
https://sciencedirect.com/science/article/pii/S0957417422010181,Categorization of knowledge graph based recommendation methods and benchmark datasets from the perspectives of application scenarios: A comprehensive survey,"Nasrullah Khan, Zongmin Ma, Kemal Polat",2022,Expert Systems with Applications,Expert Systems with Applications,100.00,sciencedirect,Explainable Recommender
https://sciencedirect.com/science/article/pii/S1071581918302192,Interactive recommending with Tag-Enhanced Matrix Factorization (TagMF),"Benedikt Loepp, Tim Donkers, Jürgen Ziegler",2019,International Journal of Human-Computer Studies,International Journal of Human-Computer Studies (IJHCS),92.16,sciencedirect,Explainable Recommender
https://sciencedirect.com/science/article/pii/S0898122122002978,Battling Gibbs phenomenon: On finite element approximations of discontinuous solutions of PDEs,Shun Zhang,2022,Computers & Mathematics with Applications,Computers & Mathematics with Applications (1987),92.13,sciencedirect,Explainable Recommender
https://sciencedirect.com/science/article/pii/S0004370220301375,"Explanation in AI and law: Past, present and future","Katie Atkinson, Trevor Bench-Capon, Danushka Bollegala",2020,Artificial Intelligence,Artifical Intelligence,97.78,sciencedirect,Explainable Recommender
https://sciencedirect.com/science/article/pii/S0950705120305153,Recommender system using Long-term Cognitive Networks,"Gonzalo Nápoles, Isel Grau, Yamisleydi Salgueiro",2020,Knowledge-Based Systems,Knowledge-Based Systems,100.00,sciencedirect,Explainable Recommender
https://sciencedirect.com/science/article/pii/S1566253523002142,Application of data fusion for automated detection of children with developmental and mental disorders: A systematic review of the last decade,"Smith K. Khare, Sonja March, U. Rajendra Acharya",2023,Information Fusion,Information Fusion,100.00,sciencedirect,Explainable Recommender
https://sciencedirect.com/science/article/pii/S0306457320309511,Accuracy-diversity trade-off in recommender systems via graph convolutions,"Elvin Isufi, Matteo Pocchiari, Alan Hanjalic",2020,Information Processing & Management,Information Procesing and Management,92.96,sciencedirect,Explainable Recommender
https://sciencedirect.com/science/article/pii/S0959652622001779,A comprehensive review on the recycling of spent lithium-ion batteries: Urgent status and technology advances,"Shan Jin, Deying Mu, Changsong Dai",2022,Journal of Cleaner Production,Journal of Cleaner Production,100.00,sciencedirect,Explainable Recommender
https://sciencedirect.com/science/article/pii/S0004370222001801,On the robustness of sparse counterfactual explanations to adverse perturbations,"Marco Virgolin, Saverio Fracaros",2022,Artificial Intelligence,Artifical Intelligence,97.78,sciencedirect,Explainable Recommender
https://sciencedirect.com/science/article/pii/S0040162522007132,"Pooling cross-sectional and time series data for estimating causality between technological innovation, affluence and carbon dynamics: A comparative evidence from developed and developing countries","Olatunji A. Shobande, Lawrence Ogbeifun",2022,Technological Forecasting and Social Change,Technological Forecasting and Social Change,100.00,sciencedirect,Explainable Recommender
